{
  "name": "turtlebot3_nav2_jazzy",
  "version": "1.0.0",
  "description": "Standard autonomous mobile navigation stack using Nav2 and TurtleBot3 on ROS 2 Jazzy.",
  "created_at": "2026-09-17T12:00:00Z",
  "updated_at": "2026-09-17T12:00:00Z",
  "robot": {
    "domain": "mobile_robotics",
    "type": "differential_drive"
  },
  "target_platform": {
    "os": "ubuntu_24_04",
    "arch": "x86_64",
    "ros_distribution": "jazzy",
    "ros_version": "jazzy"
  },
  "components": [
    {
      "resource_id": "nav2",
      "version": "1.3.0",
      "category": "navigation",
      "optional": false
    },
    {
      "resource_id": "slam_toolbox",
      "version": "2.7.4",
      "category": "mapping",
      "optional": false
    },
    {
      "resource_id": "turtlebot3",
      "version": "2.1.5",
      "category": "robot",
      "optional": false
    },
    {
      "resource_id": "cyclonedds",
      "version": "0.10.4",
      "category": "middleware",
      "optional": true
    }
  ],
  "metadata": {
    "author": "OpenRobo Core Team",
    "tags": [
      "navigation",
      "slam",
      "turtlebot3",
      "jazzy"
    ]
  }
}
